id,question,answer,category,select1,select2,select3,select4
19a021d0d8444666921adc72d5e50cf5,'앙갚음'과 '앙가픔'어떤 것이 맞는 말?,그의 앙갚음이 두려워서 말도 못했다.,알쏭달쏭 우리말,그의 앙갚음이 두려워서 말도 못했다.,,,
a0f93bfea672408bb4d6d84434371aef,'둘러메다'와 '둘쳐메다'어떤 것이 맞는 말?,큰 배낭을 어깨에 둘러메다. ,알쏭달쏭 우리말,큰 배낭을 어깨에 둘러메다. ,큰 배낭을 어깨에 둘쳐메다. ,,
3ac3383ec212434682f6f017614620f4,'사생결단'과 '사생결판'어떤 것이 맞는 말?,사생결단의 각오로 뭉친 두 팀의 격돌,알쏭달쏭 우리말,사생결단의 각오로 뭉친 두 팀의 격돌,,,
b86acb8ab6f94b51a3958463f40f7f24,'생쥐' vs '새앙쥐'어떤 것이 맞는 말?,물에 빠진 생쥐 꼴이구나.,알쏭달쏭 우리말,물에 빠진 생쥐 꼴이구나.,,,
ed6c17e3402d4628b891e39b85142270,'설레임'와 '설렘'어떤 것이 맞는 말?,설렘을 느꼈다. ,알쏭달쏭 우리말,설렘을 느꼈다. ,설레임을 느꼈다. ,,
1285828ba0f94a95b6929f45a33e2cf9,'살던 집'과 '살든 집'어떤 것이 맞는 말?,여기가 내가 살던 집이야.,알쏭달쏭 우리말,여기가 내가 살던 집이야.,,,
bb15681e63f8475aa4ff5e1f87c3a112,'걷잡다'와 '겉잡다'어떤 것이 맞는 말?,소문이 걷잡을 수 없이 퍼졌다.,알쏭달쏭 우리말,소문이 걷잡을 수 없이 퍼졌다.,,,
3e142dcbf460496484c2f543ba417bb6,어떤 것이 맞는 말?,그는 항상 의아스럽게 행동한다. ,알쏭달쏭 우리말,그는 항상 의아스럽게 행동한다. ,그는 항상 의아스러이 행동한다. ,,
480fc4bb7df142dfa2999e3f98b0b5c5,'불으면'과 '불면'어떤 것이 맞는 말?,국수가 불으면 맛이 없어.,알쏭달쏭 우리말,국수가 불으면 맛이 없어.,,,
70476bc9d6034b669e06759343dc5ab0,'귀띔'과 '귀뜸'어떤 것이 맞는 말?,친구가 조용히 귀띔을 해 주었다.,알쏭달쏭 우리말,친구가 조용히 귀띔을 해 주었다.,,,
dcf49a60a2cc4c17bc56862b5f4daf1b,'경이'와 '경의'어떤 것이 맞는 말?,스승님에게 경의를 표하다. ,알쏭달쏭 우리말,스승님에게 경의를 표하다. ,스승님에게 경이를 표하다. ,,
9a87e48742c94a9cab0469e48e96ceef,'자그마치'와 '자그만치'어떤 것이 맞는 말?,고향을 떠나온 지 자그마치 십 년이 넘었다.,알쏭달쏭 우리말,고향을 떠나온 지 자그마치 십 년이 넘었다.,,,
1f4458d56ea043e9b84fb280c1e703c7,'체불'과 '채불'어떤 것이 맞는 말?,임금 체불로 고소를 당했다.,알쏭달쏭 우리말,임금 체불로 고소를 당했다.,,,
cb4772f807ed4308858cd78001ba41e7,'갯수'와 '개수'어떤 것이 맞는 말?,제품 개수가 많지 않습니다. ,알쏭달쏭 우리말,제품 개수가 많지 않습니다. ,제품 갯수가 많지 않습니다. ,,
aff207714d0f476e9ee6861344cae9aa,'비눗갑'과 '비눗곽'어떤 것이 맞는 말?,플라스틱으로 만들어진 비눗갑,알쏭달쏭 우리말,플라스틱으로 만들어진 비눗갑,,,
7dacfac13d8d4073988b166dccbcdfe5,'곰곰이'와 '곰곰히'어떤 것이 맞는 말?,그는 곰곰이 생각에 잠겼다.,알쏭달쏭 우리말,그는 곰곰이 생각에 잠겼다.,,,
2827b0b90fe8451197795e105cf4aabe,'무난하다'와 '문안하다'어떤 것이 맞는 말?,오랜만에 할아버지께 문안했다. ,알쏭달쏭 우리말,오랜만에 할아버지께 문안했다. ,오랜만에 할아버지께 무난했다. ,,
8df8aaf6fdaf4a92bd72dec8e0fdc2c1,'밀어붙이고'와 '밀어부치고'어떤 것이 맞는 말?,나를 밀어붙이고 소리쳤다.,알쏭달쏭 우리말,나를 밀어붙이고 소리쳤다.,,,
e4856a3050a742e69de8d26348099134,'염두에'와 '염두해'어떤 것이 맞는 말?,복귀를 염두에 두다. ,알쏭달쏭 우리말,복귀를 염두에 두다. ,복귀를 염두해 두다. ,,
583e753bdf3849f5948f0644134e4311,'귀뜸'과 '귀띔'어떤 것이 맞는 말?,나한테 귀띔이라도 해주지.,알쏭달쏭 우리말,나한테 귀띔이라도 해주지.,,,
e6a26a30e9ea4f4a8bc2a28731e3ee47,'찰나'와 '찰라'어떤 것이 맞는 말?,그 찰나에 어떤 생각이 머릿속을 스쳤다.,알쏭달쏭 우리말,그 찰나에 어떤 생각이 머릿속을 스쳤다.,,,
fc9c2c365baf455fa3c6622227b3e70f,'적중율'과 '적중률'어떤 것이 맞는 말?,문제 적중률이 높습니다.,알쏭달쏭 우리말,문제 적중률이 높습니다.,,,
81350788eda9480683ec5fd67774485a,'살코기'와 '살고기'어떤 것이 맞는 말?,살코기로만 주세요. ,알쏭달쏭 우리말,살코기로만 주세요. ,살고기로만 주세요. ,,
4a9f56aba41844a399964d1768afd676,'발돋움'과 '발받침'어떤 것이 맞는 말?,담이 너무 높아 발돋움을 하고 있었다.,알쏭달쏭 우리말,담이 너무 높아 발돋움을 하고 있었다.,,,
bc1ae2b03cb74f8fb35a8153875b7145,'어획량'과 '어획양'어떤 것이 맞는 말?,오징어 어획량이 증가한다.,알쏭달쏭 우리말,오징어 어획량이 증가한다.,,,
74e2124ec1244a86a590fed68fccce43,'골똘이'와 '골똘히'어떤 것이 맞는 말?,문제를 풀려고 골똘히 생각하다.,알쏭달쏭 우리말,문제를 풀려고 골똘히 생각하다.,,,
6038f629ff9640f2b43559c928ff2924,'건들거리다'와 '건덜거리다'어떤 것이 맞는 말?,가을바람이 건들거리다.,알쏭달쏭 우리말,가을바람이 건들거리다.,,,
cc18f15a20404e798344507e3cf8ea16,'이용율'과 '이용률'어떤 것이 맞는 말?,대중교통 이용률이 높다.,알쏭달쏭 우리말,대중교통 이용률이 높다.,,,
72926a7bf3f64f7e9976fb4cb45823a2,'생존률'과 '생존율'어떤 것이 맞는 말?,생존율이 높다.,알쏭달쏭 우리말,생존율이 높다.,,,
57cb76a17bda427cab59a7a313b235f2,띄어쓰기가 맞는 것은?,거리가 멀뿐더러 차도 없다. ,올바른 띄어쓰기,거리가 멀뿐더러 차도 없다. ,거리가 멀 뿐더러 차도 없다. ,,
f1ccd3011b6d4cdc870c524057dc88de,띄어쓰기가 맞는 것은?,사고 없이 공사가 잘 끝났다. ,올바른 띄어쓰기,사고 없이 공사가 잘 끝났다. ,사고없이 공사가 잘 끝났다. ,,
24e8b2e572f84fb09fbe33ec02054715,띄어쓰기가 맞는 것은?,걔는 예쁠 뿐만 아니라 착해.,올바른 띄어쓰기,걔는 예쁠 뿐만 아니라 착해.,,,
cf755ebcfe4a4c2593401b69c81041f6,맞는 띄어쓰기는?,밤새 소리 때문에 잠을 못 잤다. ,올바른 띄어쓰기,밤새 소리 때문에 잠을 못 잤다. ,밤새 소리때문에 잠을 못 잤다. ,,
b992f064b1c7450088b1a06ad23ecb52,띄어쓰기가 맞는 것은?,태희는 예쁜 데다가 똑똑해. ,올바른 띄어쓰기,태희는 예쁜 데다가 똑똑해. ,태희는 예쁜데다가 똑똑해. ,,
3acab7ad87d845debd0bf69990a7a2e0,띄어쓰기가 맞는 것은?,언제 한번 밥 먹자.,올바른 띄어쓰기,언제 한번 밥 먹자.,,,
47eeb196730b4b05a57f42cd06763084,띄어쓰기가 맞는 것은?,오랜만에 만난 동창들,올바른 띄어쓰기,오랜만에 만난 동창들,,,
984f08418ea44a01b36b223c333fb9e5,띄어쓰기가 맞는 것은?,밤낮없이 집으로 찾아왔다.,올바른 띄어쓰기,밤낮없이 집으로 찾아왔다.,,,
ce3c903f64924269bc309872fc42dfbb,띄어쓰기가 맞는 것은?,오늘 자 신문을 읽었다.,올바른 띄어쓰기,오늘 자 신문을 읽었다.,,,
05268b11b03a4dc1992677af061cab52,띄어쓰기가 맞는 것은?,가장 잘나가는 사업이다. ,올바른 띄어쓰기,가장 잘나가는 사업이다. ,가장 잘 나가는 사업이다. ,,
83ce65e4f147493abce847db9e8c5ac2,띄어쓰기가 맞는 것은?,"아서라, 괜히 그러지 마. ",올바른 띄어쓰기,"아서라, 괜히 그러지 마. ","아서라, 괜히 그러지마. ",,
a4ee29977f8f43b5abaa4db8d6cca5c1,띄어쓰기가 맞는 것은?,물건값이 소폭 감소했다. ,올바른 띄어쓰기,물건값이 소폭 감소했다. ,물건 값이 소폭 감소했다. ,,
ab912984e9134198b8d7849da6b0de5a,띄어쓰기가 맞는 것은?,기름값이 다시 오르는 추세다.,올바른 띄어쓰기,기름값이 다시 오르는 추세다.,,,
16977ed3896a404bb2aec98b418afada,띄어쓰기가 맞는 것은?,그런 게 아니야.,올바른 띄어쓰기,그런 게 아니야.,,,
af48601e87124f2c9ede91b33f6ebdbe,맞는 띄어쓰기는?,강아지 다섯 마리가 뛰논다. ,올바른 띄어쓰기,강아지 다섯 마리가 뛰논다. ,강아지 다섯마리가 뛰논다. ,,
b64459d02263497c8efd10bf54320de4,아침부터 저녁까지 vs 아침 부터 저녁 까지,아침부터 저녁까지,올바른 띄어쓰기,아침부터 저녁까지,,,
79691f0d729347f6a2274160ef7c6ef5,띄어쓰기가 맞는 것은?,일 년 만에 합격했다. ,올바른 띄어쓰기,일 년 만에 합격했다. ,일 년만에 합격했다. ,,
660c8a1172144dc585119b49072801d9,띄어쓰기가 맞는 것은?,기름 가격이 다시 오르는 추세다. ,올바른 띄어쓰기,기름 가격이 다시 오르는 추세다. ,기름가격이 다시 오르는 추세다. ,,
7054c47ffa924a51b70fde6bda9606f6,맞는 띄어쓰기는?,그럴 줄 알았다 ,올바른 띄어쓰기,그럴 줄 알았다 ,그럴줄 알았다 ,,
184a27e5afab42f4b879ad89eeddb9df,맞는 띄어쓰기는?,일주일 만에 다 끝냈다. ,올바른 띄어쓰기,일주일 만에 다 끝냈다. ,일주일만에 다 끝냈다. ,,
699600861b8042ec97f05c212f0d353f,띄어쓰기가 맞는 것은?,내일 밤에 학교에서 만나자.,올바른 띄어쓰기,내일 밤에 학교에서 만나자.,,,
ecfe859c47704886aab812fb244d9666,맞는 띄어쓰기는?,아버지 명의로 된 주택 두 채가 있다.,올바른 띄어쓰기,아버지 명의로 된 주택 두 채가 있다.,,,
c33f8bb367074f59afd829f375bc5d75,맞는 띄어쓰기는?,꽃처럼 예쁜 아이,올바른 띄어쓰기,꽃처럼 예쁜 아이,,,
04d7c8e5f6984c67adf9e0f07464611c,맞는 띄어쓰기는?,기타 등등 ,올바른 띄어쓰기,기타 등등 ,기타등등 ,,
fe0c505f386c40aa91d87971470a6585,띄어쓰기가 맞는 것은?,홀로 술잔을 기울인다.,올바른 띄어쓰기,홀로 술잔을 기울인다.,,,
f23508aa00464e848aa8020fad3a3a30,띄어쓰기가 맞는 것은?,월 일 자 신문을 가져왔다. ,올바른 띄어쓰기,월 일 자 신문을 가져왔다. ,월 일자 신문을 가져왔다. ,,
f950d7a152544de4bdb9d24f7e7c0632,맞는 띄어쓰기는?,까먹을 뻔,올바른 띄어쓰기,까먹을 뻔,,,
39b1c1f42fe845c093ddb4aaf269c726,맞는 띄어쓰기는?,먹기는커녕 물도 못 마셨다.,올바른 띄어쓰기,먹기는커녕 물도 못 마셨다.,,,
e2c7822673484f5d808a38fd783aa296,띄어쓰기가 맞는 것은?,이제야 정말 실감 나다.,올바른 띄어쓰기,이제야 정말 실감 나다.,,,
62487939dd934064bde38daf2d18218d,맞는 띄어쓰기는?,갈 거야 ,올바른 띄어쓰기,갈 거야 ,갈거야 ,,
8a109bfa4ac0457db43c3905777daea6,맞는 띄어쓰기는?,며칠째,올바른 띄어쓰기,며칠째,,,
1192e164b69a43659820b9d1a571eb9c,띄어쓰기가 맞는 것은?,너를 영원히 사랑할 거야. ,올바른 띄어쓰기,너를 영원히 사랑할 거야. ,너를 영원히 사랑할거야. ,,
e8ffe94c6a1e43008740b48ab0151ed0,맞는 띄어쓰기는?,아는 만큼 말해 보세요. ,올바른 띄어쓰기,아는 만큼 말해 보세요. ,아는만큼 말해 보세요. ,,
a506775de2d84806b5609ba85f3d8ef5,맞는 띄어쓰기는?,버스가 떠난 지 오래야. ,올바른 띄어쓰기,버스가 떠난 지 오래야. ,버스가 떠난지 오래야. ,,
cd062bc2dc9648f090c9b217166f99db,띄어쓰기가 맞는 것은?,누가 승자인지 결판내자.,올바른 띄어쓰기,누가 승자인지 결판내자.,,,
20f2fa708ca943c3b7fb7fe8173ec875,띄어쓰기가 맞는 것은?,첫 번째 문제를 푸세요. ,올바른 띄어쓰기,첫 번째 문제를 푸세요. ,첫번째 문제를 푸세요. ,,
c298dcaa04bc48e58f359cb13989f3af,띄어쓰기가 맞는 것은?,쌀 가격이 안정을 되찾았다.,올바른 띄어쓰기,쌀 가격이 안정을 되찾았다.,,,
9778635424694d218ecca052293f4e37,띄어쓰기가 맞는 것은?,영희는 예쁜데 이기적이야.,올바른 띄어쓰기,영희는 예쁜데 이기적이야.,,,
392b52a5e8974c7a8ac0386b296c3d7a,띄어쓰기가 맞는 것은?,덩치가 집채만 하다 .,올바른 띄어쓰기,덩치가 집채만 하다 .,,,
31b0b4d7475e4e818386d4760961787f,띄어쓰기가 맞는 것은?,하루 만에 도착했습니다. ,올바른 띄어쓰기,하루 만에 도착했습니다. ,하루만에 도착했습니다. ,,
21d4674307784031804ccb09e567f116,맞는 띄어쓰기는?,네가 옆에 있다면 좋을 텐데. ,올바른 띄어쓰기,네가 옆에 있다면 좋을 텐데. ,네가 옆에 있다면 좋을텐데. ,,
9e8ef0a2604642329e082b3030fe379a,맞는 띄어쓰기는?,어찌할 바를 몰랐다. ,올바른 띄어쓰기,어찌할 바를 몰랐다. ,어찌할바를 몰랐다. ,,
977f6fb5a6ee4643859673d789768ca0,띄어쓰기가 맞는 것은?,물건 가격이 소폭 감소했다.,올바른 띄어쓰기,물건 가격이 소폭 감소했다.,,,
65c5c9e347604b498411d2777d31076e,맞는 띄어쓰기는?,갈 수 있다 ,올바른 띄어쓰기,갈 수 있다 ,갈수있다 ,갈수 있다 ,
01aa933f7e07463db45d5b041e99cea8,띄어쓰기가 맞는 것은?,저런 게 있는지 몰랐어요. ,올바른 띄어쓰기,저런 게 있는지 몰랐어요. ,저런게 있는지 몰랐어요. ,,
f304c86b306342a79736d0157ba3d652,띄어쓰기가 맞는 것은?,자연환경 보존,올바른 띄어쓰기,자연환경 보존,,,
1c5d886890c04045b0cb17ae85bfa9ef,띄어쓰기가 맞는 것은?,네가 살펴보았듯이 별로야.,올바른 띄어쓰기,네가 살펴보았듯이 별로야.,,,
3dd2a26950e74ea3806e69aa2dc2bad2,띄어쓰기가 맞는 것은?,서류를 검토한바 거짓이 발견됐다. ,올바른 띄어쓰기,서류를 검토한바 거짓이 발견됐다. ,서류를 검토한 바 거짓이 발견됐다. ,,
f152e2c494ac420cb160262968ead491,띄어쓰기가 맞는 것은?,여름이 코앞으로 다가왔다.,올바른 띄어쓰기,여름이 코앞으로 다가왔다.,,,
dc6513f1daed49a1b3732c8e01d369a2,맞는 띄어쓰기는?,지금 또한 중요하다. ,올바른 띄어쓰기,지금 또한 중요하다. ,지금또한 중요하다. ,,
ed62fe30e72d49e09bd0e0217bc9f51b,띄어쓰기가 맞는 것은?,일은 차질 없이 잘 진행된다. ,올바른 띄어쓰기,일은 차질 없이 잘 진행된다. ,일은 차질없이 잘 진행된다. ,,
280925a64167451ea26dc70c837737a6,맞는 띄어쓰기는?,한데 합쳤다.,올바른 띄어쓰기,한데 합쳤다.,,,
6d8cfbbc410a4148a00deb68749fc765,띄어쓰기가 맞는 것은?,그러면 할 수 없지.,올바른 띄어쓰기,그러면 할 수 없지.,,,
63a408e3e5b6491c98547c6548c7403f,띄어쓰기가 맞는 것은?,한두 번 해 본 솜씨가 아니야. ,올바른 띄어쓰기,한두 번 해 본 솜씨가 아니야. ,한 두번 해 본 솜씨가 아니야. ,,
b8eb79252a36498dad62ddc070eb0453,맞는 띄어쓰기는?, 대 로 이겼다.,올바른 띄어쓰기, 대 로 이겼다.,,,
ee7e1862ede543a392e5c5ca7f531246,맞는 띄어쓰기는?,쇠고기 근 ,올바른 띄어쓰기,쇠고기 근 ,쇠고기  근 ,,
4f51faebc7e642e8b972c6375be1d9e0,띄어쓰기가 맞는 것은?,사흘간 여행은 즐거웠어요. ,올바른 띄어쓰기,사흘간 여행은 즐거웠어요. ,사흘 간 여행은 즐거웠어요. ,,
f4ecb9966dd7433d83e14d2d044d8c09,띄어쓰기가 맞는 것은?,너부터 먼저 먹어라. ,올바른 띄어쓰기,너부터 먼저 먹어라. ,너 부터 먼저 먹어라. ,,
ae148a41f8e647b4a264d42d64e74fab,띄어쓰기가 맞는 것은?,차 한 대를 판매했다. ,올바른 띄어쓰기,차 한 대를 판매했다. ,차 한대를 판매했다. ,차한대를 판매했다. ,
184c3236b4d8475c86963d6b2e4682fe,띄어쓰기가 맞는 것은?,오늘 못한 부분은 다음 날 해! ,올바른 띄어쓰기,오늘 못한 부분은 다음 날 해! ,오늘 못한 부분은 다음날 해! ,,
e50ad32f70d64fd4bb145ee5bb293f77,띄어쓰기가 맞는 것은?,그녀는 동물을 흉내 낸다. ,올바른 띄어쓰기,그녀는 동물을 흉내 낸다. ,그녀는 동물을 흉내낸다. ,,
df6a931924a2422a83e24f1ff63e3bef,띄어쓰기가 맞는 것은?,특정 징후 없이 나타난다.,올바른 띄어쓰기,특정 징후 없이 나타난다.,,,
58b3401e9db24af78883bb0000c8498d,띄어쓰기가 맞는 것은?,일주일에 책 한 권은 꼭 읽어.,올바른 띄어쓰기,일주일에 책 한 권은 꼭 읽어.,,,
f593161dfecb4c07bbb2b1229901897b,띄어쓰기가 맞는 것은?,오래전부터 널 지켜보았어. ,올바른 띄어쓰기,오래전부터 널 지켜보았어. ,오래 전부터 널 지켜보았어. ,오래전 부터 널 지켜보았어. ,
a438616a8ef7473190dcd22743ab8c88,어떤 것이 맞는 말?,"백만 스물하나, 백만 스물둘 ",올바른 띄어쓰기,"백만 스물하나, 백만 스물둘 ","백만스물하나, 백만스물둘 ",,
7af077fa0d0e411d9d94be88b828be77,띄어쓰기가 맞는 것은?,"사과, 배 등",올바른 띄어쓰기,"사과, 배 등",,,
2ada1cba4b2049bc86137f905f0491cd,띄어쓰기가 맞는 것은?,이 경기는 일 대 일로 마쳤다. ,올바른 띄어쓰기,이 경기는 일 대 일로 마쳤다. ,이 경기는 일대일로 마쳤다. ,,
57698cefbd9e4951bf3bd7885b291aa6,띄어쓰기가 맞는 것은?,전 좌석 안전벨트,올바른 띄어쓰기,전 좌석 안전벨트,,,
b1271d655a3f4f239b1e940d4e501d5e,맞는 띄어쓰기는?,첫 월급 ,올바른 띄어쓰기,첫 월급 ,첫월급 ,,
796902b7b6f04c4fb3f42ccde4f38425,띄어쓰기가 맞는 것은?,당신과 함께 살고 싶어요.,올바른 띄어쓰기,당신과 함께 살고 싶어요.,,,
64d0258b62864b35b9dd7c41167437f3,띄어쓰기가 맞는 것은?,그는 시인 겸 소설가이다. ,올바른 띄어쓰기,그는 시인 겸 소설가이다. ,그는 시인겸 소설가이다. ,,
a88d8cdd31a6425f8ee107a698c7f2d7,띄어쓰기가 맞는 것은?,친구 간의 우정이 돈독하다. ,올바른 띄어쓰기,친구 간의 우정이 돈독하다. ,친구간의 우정이 돈독하다. ,,
952730d24a0b4be6b20540d4df64e700,맞는 띄어쓰기는?,하루 내지 이틀 ,올바른 띄어쓰기,하루 내지 이틀 ,하루내지이틀 ,하루내지 이틀 ,
ebf39d7b30de4947b8ed243ab621114e,맞는 띄어쓰기는?,과자 한 개를 샀다. ,올바른 띄어쓰기,과자 한 개를 샀다. ,과자 한개를 샀다. ,,
070ebe975e1b4a3395a64ca5c76e7ee7,맞는 띄어쓰기는?,동생이 형보다 더 크다.,올바른 띄어쓰기,동생이 형보다 더 크다.,,,
f84b37e6bded4b3b828329877f900e5e,맞는 띄어쓰기는?,오늘 학습할 부분은 제장입니다.,올바른 띄어쓰기,오늘 학습할 부분은 제장입니다.,,,
28608278e0f44286ae0edfcdbc6e5271,띄어쓰기가 맞는 것은?,바람난 사람,올바른 띄어쓰기,바람난 사람,,,
b90dd2bac1e8421cace1c8d1105a693f,띄어쓰기가 맞는 것은?,그는 요리도 참 잘한다.,올바른 띄어쓰기,그는 요리도 참 잘한다.,,,
229cd4ff680b4a3eac2bf7cde848683b,띄어쓰기가 맞는 것은?,부부간에 금실이 좋다.,올바른 띄어쓰기,부부간에 금실이 좋다.,,,
8f835ed8d6fe476bbcbad9e97e286ee0,맞는 띄어쓰기는?,미리미리 준비할걸.,올바른 띄어쓰기,미리미리 준비할걸.,,,
aacd1610a53b4f06b2a8bc42f04c597c,띄어쓰기가 맞는 것은?,여행을 갈 것이다.,올바른 띄어쓰기,여행을 갈 것이다.,,,
38828504b27c4cb9ac9ae0e5a439c769,띄어쓰기가 맞는 것은?,바닷속 생물은 아름다워.,올바른 띄어쓰기,바닷속 생물은 아름다워.,,,
72ef0a08ad77464792e863c9d23467ae,띄어쓰기가 맞는 것은?,자매간에 우애가 남다르다.,올바른 띄어쓰기,자매간에 우애가 남다르다.,,,
9366670f107f420fb4a7253be8cef62b,맞는 띄어쓰기는?,우리 아들은 올해 열 살이에요. ,올바른 띄어쓰기,우리 아들은 올해 열 살이에요. ,우리 아들은 올해 열살이에요. ,,
c348f01602ba43ec972a565a57faab6a,맞는 띄어쓰기는?,괜찮은 척 ,올바른 띄어쓰기,괜찮은 척 ,괜찮은척 ,,
b06cc4d14f3140d3b9ab6adfb9786f8b,띄어쓰기가 맞는 것은?,저 녀석 버르장머리하고는 ,올바른 띄어쓰기,저 녀석 버르장머리하고는 ,저 녀석 버르장머리 하고는 ,저 녀석 버르장 머리 하고는 ,
1ac2f0a16b1942a582cdb4d5afd65dc1,띄어쓰기가 맞는 것은?,목소리를 똑같이 흉내 냈다. ,올바른 띄어쓰기,목소리를 똑같이 흉내 냈다. ,목소리를 똑같이 흉내냈다. ,,
93e38f9e098044aa916a67a9a6a74ef9,띄어쓰기가 맞는 것은?,쌀값이 안정을 되찾았다. ,올바른 띄어쓰기,쌀값이 안정을 되찾았다. ,쌀 값이 안정을 되찾았다. ,,
7fa103d8a1214b55845340a9d3cbfe90,맞는 띄어쓰기는?,문제가 생길 경우 연락 주세요. ,올바른 띄어쓰기,문제가 생길 경우 연락 주세요. ,문제가 생길경우 연락 주세요. ,,
1046dab7bea8401885bea069399cb049,띄어쓰기가 맞는 것은?,너 자꾸 이러면 미워할 거다. ,올바른 띄어쓰기,너 자꾸 이러면 미워할 거다. ,너 자꾸 이러면 미워할거다. ,,
7b8c4195e23347b583491a6034290b9c,맞는 띄어쓰기는?,그 정도 실력이면 충분하다. ,올바른 띄어쓰기,그 정도 실력이면 충분하다. ,그정도 실력이면 충분하다. ,,
10e1c5e8bf514dc6b77b1842a7afcafe,띄어쓰기가 맞는 것은?,그런 소리 하지 마.,올바른 띄어쓰기,그런 소리 하지 마.,,,
be5aa75a43714af6b3020e01c2162ee7,띄어쓰기가 맞는 것은?,질문에 대해 자세히 답변드렸다.,올바른 띄어쓰기,질문에 대해 자세히 답변드렸다.,,,
72907a7c9c2244b18a89f3b070902820,맞는 띄어쓰기는?,선물 같은 하루 ,올바른 띄어쓰기,선물 같은 하루 ,선물같은 하루 ,,
71513b31547340a18021fc7ed79aac92,띄어쓰기가 맞는 것은?,지금은 근무 중입니다. ,올바른 띄어쓰기,지금은 근무 중입니다. ,지금은 근무중입니다. ,,
cf6840e37f7d4109bb1af1521e06d9d4,띄어쓰기가 맞는 것은?,요즘 정말 살맛 난다.,올바른 띄어쓰기,요즘 정말 살맛 난다.,,,
9a5842eedca044efb87f96947062d4ff,띄어쓰기가 맞는 것은?,운전 중에 문자 하지 마세요. ,올바른 띄어쓰기,운전 중에 문자 하지 마세요. ,운전중에 문자 하지 마세요. ,,
d348655bdb1e4ed7b90e6b5d6813614c,띄어쓰기가 맞는 것은?,거짓말이 다 들통나 버렸다.,올바른 띄어쓰기,거짓말이 다 들통나 버렸다.,,,
e5772c5470db4310bef94665d5cb1d16,띄어쓰기가 맞는 것은?,모인 사람이 몇 천만 명이었습니까? ,올바른 띄어쓰기,모인 사람이 몇 천만 명이었습니까? ,모인 사람이 몇천만 명이었습니까? ,,
f1e20fabfed849e986466fed0fb22778,띄어쓰기가 맞는 것은?,재난 피해로 내남없이 힘들었다.,올바른 띄어쓰기,재난 피해로 내남없이 힘들었다.,,,
01ea26bac6f0489f8a52260d82eca697,띄어쓰기가 맞는 것은?,요즘 먹고살기가 힘들다.,올바른 띄어쓰기,요즘 먹고살기가 힘들다.,,,
dd1846468fb34234886ffac1e4ab4875,띄어쓰기가 맞는 것은?,오랜만에 청계천을 걸었다.,올바른 띄어쓰기,오랜만에 청계천을 걸었다.,,,
09e0fc11b14548128f6b59434fd846a3,띄어쓰기가 맞는 것은?,겁나서 못 하겠다.,올바른 띄어쓰기,겁나서 못 하겠다.,,,
7596bb13806c4afdacc0c1d7fcdedc5b,띄어쓰기가 맞는 것은?,이렇게 할 수밖에 없었어요. ,올바른 띄어쓰기,이렇게 할 수밖에 없었어요. ,이렇게 할수밖에 없었어요. ,이렇게 할수 밖에 없었어요. ,이렇게 할 수 밖에 없었어요. 
b49bd037616d4f44a467f211adf55df6,맞는 띄어쓰기는?,밤새 한숨도 못 잤다. ,올바른 띄어쓰기,밤새 한숨도 못 잤다. ,밤새 한숨도 못잤다. ,,
25e6d4528ace4d53836c52a1e4def092,띄어쓰기가 맞는 것은?,노래를 못해서 연습했다.,올바른 띄어쓰기,노래를 못해서 연습했다.,,,
090f7a4715a74dcaa0aede29ffcc14a2,띄어쓰기가 맞는 것은?,다음 번은 네 차례다.,올바른 띄어쓰기,다음 번은 네 차례다.,,,
b87b5f6809b14ad7a6b77c9f4be3a82e,맞는 띄어쓰기는?,오늘 한잔할까?,올바른 띄어쓰기,오늘 한잔할까?,,,
819f3dc34f02461aa65be4cca5455e95,맞는 띄어쓰기는?,각 사람 ,올바른 띄어쓰기,각 사람 ,각사람 ,,
827d8d70366f4f7bba119fb1991a6684,띄어쓰기가 맞는 것은?,오 차장님을 응원합니다. ,올바른 띄어쓰기,오 차장님을 응원합니다. ,오차장님을 응원합니다. ,,
143c11f1fa8b472cb53b4b7d9de5209b,띄어쓰기가 맞는 것은?,남매간에 의가 좋다.,올바른 띄어쓰기,남매간에 의가 좋다.,,,
8e5838bcb15d4cfe9fbd664ddcca6dff,띄어쓰기가 맞는 것은?,현관 밖에는 아무도 없다. ,올바른 띄어쓰기,현관 밖에는 아무도 없다. ,현관밖에는 아무도 없다. ,,
0e1e9123b8e74283aa6d2c84978cf9f3,띄어쓰기가 맞는 것은?,나에게는 이제 가족밖에 없다.,올바른 띄어쓰기,나에게는 이제 가족밖에 없다.,,,
8bfadc9ce71741b6a47683d55b3d888b,맞는 띄어쓰기는?,기분 탓 ,올바른 띄어쓰기,기분 탓 ,기분탓 ,,
344545d0c27545c8bfb3a6544ff9a42d,띄어쓰기가 맞는 것은?,조금 아프기밖에 더하겠니? ,올바른 띄어쓰기,조금 아프기밖에 더하겠니? ,조금 아프기 밖에 더하겠니? ,,
0d91ef27208d4e358b8ec4059c3808b6,띄어쓰기가 맞는 것은?,물 잔을 건네주세요. ,올바른 띄어쓰기,물 잔을 건네주세요. ,물잔을 건네주세요. ,,
5639c661b8a74dbf83a2b1047fd5fbe2,띄어쓰기가 맞는 것은?,적을 남김없이 무찌르다. ,올바른 띄어쓰기,적을 남김없이 무찌르다. ,적을 남김 없이 무찌르다. ,,
