id,question,answer,category,select1,select2,select3,select4
629cc3e9ae4b4302be769624468639cb,교만하여 다른 사람을 업신여김,안하무인 (眼下無人),이럴 땐 사자성어,안하무인 (眼下無人),,,
2f5788a34a9147ceafe654270ff763a0,설상가상(雪上加霜)의 뜻은?,난처한 일이나 불행한 일이 잇따라 일어남 ,이럴 땐 사자성어,난처한 일이나 불행한 일이 잇따라 일어남 ,난처하거나 딱한 일이 벌어짐 ,뜻밖에 불행한 일을 겪음 ,
9beacdfef76549cfa714ba04a3d1d81e,거두절미(去頭截尾)의 뜻은?,어떤 일의 요점만 간단히 말함,이럴 땐 사자성어,어떤 일의 요점만 간단히 말함,,,
5d214d295f364f00b8f87065e970e830,고견탁론(高見卓論)의 뜻은?,식견이 높은 견해와 탁월한 이론,이럴 땐 사자성어,식견이 높은 견해와 탁월한 이론,,,
a56c3f2655e24403a5787402851ee4c8,풍찬노숙(風餐露宿)의 뜻은?,객지에서 많은 고생을 겪음 ,이럴 땐 사자성어,객지에서 많은 고생을 겪음 ,많은 어려움에도 굴하지 않음 ,아름다운 자연을 즐기는 사람 ,
92085dc45721400cafadce51623c6889,삼고초려(三顧草廬)의 뜻은?,인재를 맞아들이기 위하여 참을성 있게 노력함 ,이럴 땐 사자성어,인재를 맞아들이기 위하여 참을성 있게 노력함 ,바쁜 와중에 틈을 내면서 어렵게 공부함 ,누구의 도움도 받을 수 없는 고립 상태에 빠짐 ,
652f672c6d0b41e0802761f1fd86a6a5,발본색원(拔本塞源)의 뜻은?,사물의 폐단을 없애기 위해 뿌리째 뽑아 버림 ,이럴 땐 사자성어,사물의 폐단을 없애기 위해 뿌리째 뽑아 버림 ,단단하고 굳세어서 뽑히지 않음 ,작은 일에 지나치게 큰 대책을 세움 ,
089201344c0b42ba87f0d906d3ac9b1d,고립무원(孤立無援)의 뜻은?,고립되어 구원을 받을 데가 없음 ,이럴 땐 사자성어,고립되어 구원을 받을 데가 없음 ,고립되어 의지할 데가 없음 ,고립되어 마음이 답답하고 고생스러움 ,
4697fb58b2474ae0a8897dafbe9c0f16,사상누각(沙上樓閣)의 뜻은?,기초가 튼튼하지 못하여 오래 견디지 못할 일이나 물건 ,이럴 땐 사자성어,기초가 튼튼하지 못하여 오래 견디지 못할 일이나 물건 ,눈을 마주하여 깜박이지 않고 오래 견디기를 겨룸 ,초가 반석처럼 튼튼함을 이르는 말 ,
8446c77ac192422090b7ae2943e08e6b,만사형통(萬事亨通)의 뜻은?,모든 것이 뜻대로 잘됨,이럴 땐 사자성어,모든 것이 뜻대로 잘됨,,,
b11d27ed0584492ea0e01d4e695e9318,천태만상(千態萬象)의 뜻은?,사물이 한결같지 아니하고 각각 모습이 다름 ,이럴 땐 사자성어,사물이 한결같지 아니하고 각각 모습이 다름 ,일의 형세나 정세 따위가 변함 ,사람의 모습이나 됨됨이가 자라면서 달라짐 ,
dbdab5997d684a94b95c21f42b382776,오래 살고 복을 누리며 건강하고 평안함,수복강녕 (壽福康寧) ,이럴 땐 사자성어,수복강녕 (壽福康寧) ,오동수복 (烏銅壽福) ,망년지우 (忘年之友) ,
4879f72cba7a4273baaf1a9769df2e70,속수무책(束手無策)의 뜻은?,손을 묶은 것처럼 어찌할 도리가 없어 꼼짝 못 함 ,이럴 땐 사자성어,손을 묶은 것처럼 어찌할 도리가 없어 꼼짝 못 함 ,어려운 일이 겹침 ,너무 바빠서 두서를 잡지 못하고 허둥댐 ,
bd865236173243ffbef6947b7685c8cf,태산북두(泰山北斗)의 뜻은?,세상 사람들로부터 존경받는 사람,이럴 땐 사자성어,세상 사람들로부터 존경받는 사람,,,
7449a37474884f419c09f45a9c85cc6f,어떤 일이든 끊임없이 노력하면 반드시 이루어짐,우공이산 (愚公移山) ,이럴 땐 사자성어,우공이산 (愚公移山) ,주지육림 (酒池肉林) ,도원결의 (桃園結義) ,
6f1f0afcecb940a3a0b548fc8c4bee52,권토중래(捲土重來)의 뜻은?,한 번의 실패 후에 힘을 회복하여 다시 쳐들어옴 ,이럴 땐 사자성어,한 번의 실패 후에 힘을 회복하여 다시 쳐들어옴 ,뜻밖에 닥쳐오는 모질고 사나운 일 ,즐거운 일이 지나가면 슬픈 일이 닥쳐옴 ,
cb736b18939841bebcd378b1675f2e9d,애매모호(曖昧模糊)의 뜻은?,말이나 태도 따위가 희미하고 흐려 분명하지 아니함 ,이럴 땐 사자성어,말이나 태도 따위가 희미하고 흐려 분명하지 아니함 ,형체가 있는지 없는지 분명하지 아니함 ,미래의 전망이 예측할 수 없게 분명하지 아니함 ,
b0d2e4e583b842a48051ed77816e981a,두주불사(斗酒不辭)의 뜻은?,말술도 사양하지 않을 만큼 술을 매우 잘 마심 ,이럴 땐 사자성어,말술도 사양하지 않을 만큼 술을 매우 잘 마심 ,술과 음식을 축내며 일을 하지 않는 사람 ,함께 술을 마시면서 묵은 원한을 잊어버림 ,
9ec97200571247e09a07bab5d0e07147,백년해로(百年偕老)의 뜻은?,부부가 서로 사이좋게 지내고 즐겁게 함께 늙음,이럴 땐 사자성어,부부가 서로 사이좋게 지내고 즐겁게 함께 늙음,,,
be702e851ad74bd1aaedaa844e627f7e,일망타진(一網打盡)의 뜻은?,어떤 무리를 한꺼번에 모조리 다 잡음 ,이럴 땐 사자성어,어떤 무리를 한꺼번에 모조리 다 잡음 ,근본을 빼내고 원천을 막아 버림 ,주된 일이 되면 다른 일도 그에 따라서 이루어짐 ,
6409453fc24d4f9fbe744a820787122f,출세를 하여 고향에 돌아가거나 돌아옴,금의환향 (錦衣還鄕) ,이럴 땐 사자성어,금의환향 (錦衣還鄕) ,도원결의 (桃園結義) ,극기복례 (克己復禮) ,
59dfe70eab7c4b0e8d755b7e991da6bd,전인미답(前人未踏)의 뜻은?,이제까지 그 누구도 손을 대지 않음 ,이럴 땐 사자성어,이제까지 그 누구도 손을 대지 않음 ,앞사람의 실패를 거울삼아 주의함 ,전에도 없었고 앞으로도 있을 수 없음 ,
2ed0e61873fa47baaaf40dbe4799f4b8,자업자득(自業自得)의 뜻은?,자기가 저지른 일의 결과를 자기가 받음 ,이럴 땐 사자성어,자기가 저지른 일의 결과를 자기가 받음 ,자기가 한 일에 대해 스스로 미흡하게 여김 ,잘못을 뉘우쳐 다시는 그런 잘못이 없도록 함 ,
950f3f0e65e34469b0ac844d47a7d51d,구밀복검(口蜜腹劍)의 뜻은?,말로는 친한 듯하나 속으로는 해칠 생각이 있음 ,이럴 땐 사자성어,말로는 친한 듯하나 속으로는 해칠 생각이 있음 ,겉으로는 친한 체하면서 속으로는 멀리함 ,말로는 옳다 하면서 마음속으로는 그르게 여김 ,
6c0e2602bedd4accb97bcfa7fe708f61,독서삼도(讀書三到)의 뜻은?,독서를 하는 세 가지 방법 ,이럴 땐 사자성어,독서를 하는 세 가지 방법 ,독서로 도를 전한 세 명의 인물 ,독서를 해야 하는 세 가지 이유 ,
0ac8934e4ec44138a717747e86cf640e,일장춘몽(一場春夢)의 뜻은?,한바탕의 봄꿈처럼 헛된 영화나 덧없는 일,이럴 땐 사자성어,한바탕의 봄꿈처럼 헛된 영화나 덧없는 일,,,
e1688fd692e04dd6bba6394b428febf7,자격지심(自激之心)의 뜻은?,자기가 한 일에 대하여 미흡하게 여기는 마음 ,이럴 땐 사자성어,자기가 한 일에 대하여 미흡하게 여기는 마음 ,자기 마음을 스스로 위로함 ,자신의 품위를 스스로 지키는 마음 ,
ff184e8bfdae45d0a7ddd3e66a068e0e,독야청청(獨也靑靑)의 뜻은?,홀로 절개를 굳세게 지키고 있음 ,이럴 땐 사자성어,홀로 절개를 굳세게 지키고 있음 ,한 집이나 일정한 곳을 지키고 있음 ,한번 먹은 마음을 굳게 지켜 나가는 성질 ,
ed4618a353524814b1de2f68edd75c14,망망대해(茫茫大海)의 뜻은?,한없이 크고 넓은 바다 ,이럴 땐 사자성어,한없이 크고 넓은 바다 ,한없이 크고 넓은 세계 ,산과 바다처럼 크고 넓은 은혜 ,
dea5541f0a5b41e19132e78b2e62ff69,노심초사(勞心焦思)의 뜻은?,몹시 마음을 쓰며 애를 태움,이럴 땐 사자성어,몹시 마음을 쓰며 애를 태움,,,
90efec36a018458db00a1c16e0cf18f6,파란만장(波瀾萬丈)의 뜻은?,여러 가지 곡절과 시련이 많고 변화가 심함 ,이럴 땐 사자성어,여러 가지 곡절과 시련이 많고 변화가 심함 ,감정의 변화가 심하고 기분에 치우침 ,꼼꼼하고 자세한 일의 형편이나 곡절 ,
066a51ad89e0460c85016fa9a06f4f31,금지옥엽(金枝玉葉)의 뜻은?,귀한 자손을 이르는 말,이럴 땐 사자성어,귀한 자손을 이르는 말,,,
e754b13af2f241fa895075c0d1320cee,주야장천(晝夜長川)의 뜻은?,밤낮으로 쉬지 아니하고 연달아 ,이럴 땐 사자성어,밤낮으로 쉬지 아니하고 연달아 ,밤낮으로 학문에 힘쓰는 모습 ,밤낮으로 부지런히 일하며 효도함 ,
4f204506d8b2473f87f020c74ccab814,기세등등(氣勢騰騰)의 뜻은?,기세가 매우 높고 힘찬 모양 ,이럴 땐 사자성어,기세가 매우 높고 힘찬 모양 ,기세가 몹시 사납고 세찬 정도 ,기세가 위엄 있고 떳떳함 ,
1f8ec743ce4f40de9153e5ca45332d94,남가일몽(南柯一夢)의 뜻은?,덧없는 꿈이나 한때의 헛된 부귀영화 ,이럴 땐 사자성어,덧없는 꿈이나 한때의 헛된 부귀영화 ,외부와 접촉을 끊고 학문에 정진함 ,같이 행동하면서도 속으로는 각각 딴생각을 하고 있음 ,
327f7ee818bf4cc0a389fb54da9d9dc5,문일지십(聞一知十)의 뜻은?,하나를 듣고 열 가지를 미루어 앎 ,이럴 땐 사자성어,하나를 듣고 열 가지를 미루어 앎 ,끊임없이 노력해 기어이 이루어 냄 ,영화는 일시적이어서 계속되지 않음 ,
50c6721a2e2c4a87a1853d3ba1b2ce8c,초지일관(初志一貫)의 뜻은?,처음에 세운 뜻을 끝까지 밀고 나감 ,이럴 땐 사자성어,처음에 세운 뜻을 끝까지 밀고 나감 ,행동하거나 밀고 나가는 기세가 강함 ,일을 다그쳐 냅다 밀고 나감 ,
086640307abd4836ba57554d0e97a5af,감언지지(敢言之地)의 뜻은?,거리낌 없이 말할 만한 자리나 처지 ,이럴 땐 사자성어,거리낌 없이 말할 만한 자리나 처지 ,거리낌 없이 큰 소리로 하는 말 ,말이나 행동을 거리낌 없이 함부로 하는 태도 ,
a394fc23324a4acd8c5cb5f08600de23,풍수지탄(風樹之歎)의 뜻은?,효를 다하지 못하고 어버이를 여읜 자식의 슬픔,이럴 땐 사자성어,효를 다하지 못하고 어버이를 여읜 자식의 슬픔,,,
a0b3e3aaed0744309492ebb9aa8dcf96,전화위복(轉禍爲福)의 뜻은?,재앙과 화난이 바뀌어 오히려 복이 됨,이럴 땐 사자성어,재앙과 화난이 바뀌어 오히려 복이 됨,,,
d9e872ca4f514ed396148431c18857f9,바른 길에서 벗어난 학문으로 세상 사람에게 아첨함,곡학아세 (曲學阿世) ,이럴 땐 사자성어,곡학아세 (曲學阿世) ,다문박식 (多聞博識) ,견리사의 (見利思義) ,
79ebc23007f24e72b2624324b0ff66f8,간사하고 악독하며 도리에 어긋나는 데가 있음,간악무도 (奸惡無道),이럴 땐 사자성어,간악무도 (奸惡無道),,,
8f6df4e5d0da47a0893bbb00458183c2,어불성설(語不成說)의 뜻은?,말이 조금도 사리에 맞지 아니함 ,이럴 땐 사자성어,말이 조금도 사리에 맞지 아니함 ,사물이 제격에 맞지 아니함 ,서로 호흡이나 마음이 맞지 아니함 ,
01cdeb7cdaaf41e5993a5b88c6cf6f17,고생 하면서 부지런하고 꾸준하게 공부하는 자세,형설지공 (螢雪之功) ,이럴 땐 사자성어,형설지공 (螢雪之功) ,역지사지 (易地思之) ,신상필벌 (信賞必罰) ,
213bea9ca96f46e9a3f76704db951155,동분서주(東奔西走)의 뜻은?,사방으로 몹시 바쁘게 돌아다님,이럴 땐 사자성어,사방으로 몹시 바쁘게 돌아다님,,,
245562365d0a47c3be2e6364e87ec1f1,영고성쇠(榮枯盛衰)의 뜻은?,인생이나 사물의 번성함과 쇠락함이 서로 바뀜 ,이럴 땐 사자성어,인생이나 사물의 번성함과 쇠락함이 서로 바뀜 ,한바탕의 봄꿈처럼 헛된 영화나 덧없는 일 ,어질고 착한 임금이 다스리는 태평한 세상의 모습 ,
ee381b23239a48559d70d0dfcfb3aa6f,자가당착(自家撞着)의 뜻은?,말이나 행동이 앞뒤가 서로 맞지 않음 ,이럴 땐 사자성어,말이나 행동이 앞뒤가 서로 맞지 않음 ,터무니없는 짓을 꾀함 ,자신이 들은 것을 마음속에 깊이 간직함 ,
b6b8c6c492164b74b94327151b722b0a,좋은 일에는 흔히 방해되는 일이 많음,호사다마 (好事多魔) ,이럴 땐 사자성어,호사다마 (好事多魔) ,목불식정 (目不識丁) ,일념통천 (一念通天) ,
28537b942f36426991acf96c8dca1ef4,삼일천하(三日天下)의 뜻은?,정권을 잡았다가 짧은 기간 내에 밀려남 ,이럴 땐 사자성어,정권을 잡았다가 짧은 기간 내에 밀려남 ,결심이 얼마 되지 않아 흐지부지 됨 ,인재를 얻기 위해 참을성 있게 노력함 ,
678f88a1fc3047308fd5c4485df20bc2,수미상응(首尾相應)의 뜻은?,서로 응하여 도와줌 ,이럴 땐 사자성어,서로 응하여 도와줌 ,부르는 말에 응함 ,말로 남을 도와줌 ,
cc170312c743416bbad48c9af644381b,필부지용(匹夫之勇)의 뜻은?,혈기만 믿고 함부로 부리는 소인의 용기 ,이럴 땐 사자성어,혈기만 믿고 함부로 부리는 소인의 용기 ,오랜 체험에서 얻은 용기 ,앞뒤를 생각하지 않고 용맹스럽게 돌진함 ,
1f83ce950b1847339246bb8a95aeb73e,포복절도(抱腹絕倒)의 뜻은?,배를 그러안고 넘어질 정도로 몹시 웃음,이럴 땐 사자성어,배를 그러안고 넘어질 정도로 몹시 웃음,,,
dd43a72762c64739be044bc0a2da547c,금시초문(今始初聞)의 뜻은?,바로 지금 처음으로 들음 ,이럴 땐 사자성어,바로 지금 처음으로 들음 ,바로 듣지 못하고 잘못 들음 ,비방하거나 나무라는 말을 들음 ,
b58e009aa8f946eebb590ec24140a9f0,조변석개(朝變夕改)의 뜻은?,계획이나 결정 따위를 일관성이 없이 자주 고침,이럴 땐 사자성어,계획이나 결정 따위를 일관성이 없이 자주 고침,,,
d8cf5fe3d47d439c94f938bf371b4905,언감생심(焉敢生心)의 뜻은?,전혀 그런 마음이 없었음,이럴 땐 사자성어,전혀 그런 마음이 없었음,,,
14ddcbb8a5e04d9a9f848bd32d4bf4fe,곡학아세(曲學阿世)의 뜻은?,바른 길에서 벗어난 학문으로 세상 사람에게 아첨함 ,이럴 땐 사자성어,바른 길에서 벗어난 학문으로 세상 사람에게 아첨함 ,아첨하는 사람을 미워함 ,지위나 권세가 있는 사람에게 아첨하여 남의 지위를 빼앗음 ,
ba5ef4c30b7c459ea3821edd9a2af383,이용후생(利用厚生)의 뜻은?,"기구를 편리하게 쓰고, 백성의 생활을 넉넉하게 함 ",이럴 땐 사자성어,"기구를 편리하게 쓰고, 백성의 생활을 넉넉하게 함 ",제자나 후배가 스승이나 선배보다 뛰어남 ,내세에 안락하고자 하는 마음으로 선행을 쌓음 ,
cbdc7de688924ef9afd61451106b56a2,귤화위지(橘化爲枳)의 뜻은?,환경에 따라 사람이나 사물의 성질이 변함,이럴 땐 사자성어,환경에 따라 사람이나 사물의 성질이 변함,,,
5ded5f80e4334e28bf48d6ce9bace37e,말에 순서와 줄거리가 없음,어무윤척 (語無倫脊),이럴 땐 사자성어,어무윤척 (語無倫脊),,,
b154215e5b214772a04ed6088289297b,옥상가옥(屋上架屋)의 뜻은?,물건이나 일을 부질없이 거듭함,이럴 땐 사자성어,물건이나 일을 부질없이 거듭함,,,
9f1ab19655234f3d91d8b7d194e83b9f,옛것을 익히고 그것을 미루어서 새것을 앎,온고지신 (溫故知新),이럴 땐 사자성어,온고지신 (溫故知新),,,
83f682f0487b4bfbb7ddc8fceb1b65eb,지리멸렬(支離滅裂)의 뜻은?,이리저리 흩어지고 찢기어 갈피를 잡을 수 없음 ,이럴 땐 사자성어,이리저리 흩어지고 찢기어 갈피를 잡을 수 없음 ,여러 갈피가 낱낱이 거듭되는 모양 ,새가 흩어지고 짐승이 사방으로 달아남 ,
8d414f138de24901a2a231f7bba93951,주지육림(酒池肉林)의 뜻은?,호사스러운 술잔치,이럴 땐 사자성어,호사스러운 술잔치,,,
c9e30872675e4842a70492c46ceef219,큰 목적을 위하여 자기가 아끼는 사람을 버림,읍참마속 (泣斬馬謖),이럴 땐 사자성어,읍참마속 (泣斬馬謖),,,
ba08810142e34f79a6b9d140ae4c6784,백절불굴(百折不屈)의 뜻은?,어떠한 난관에도 굽히지 않음 ,이럴 땐 사자성어,어떠한 난관에도 굽히지 않음 ,흔들어도 꿈적도 하지 않음 ,훗날에 성공을 위해 잠시 굽힘 ,
353658d7e9cf4bcaa581122a7ea701ec,적수공권(赤手空拳)의 뜻은?,아무것도 가진 것이 없음 ,이럴 땐 사자성어,아무것도 가진 것이 없음 ,아무 소용이 없는 물건 ,항상 책을 쥐고 놓지 아니함 ,
edd58ba336a44011b6dae21cdf94bbf4,세월이 빨리 흘러감,오비토주 (烏飛兔走) ,이럴 땐 사자성어,오비토주 (烏飛兔走) ,종회여류 (從懷如流) ,세세연년 (歲歲年年) ,세가월증 (歲加月增) 
329ebc9a30bb46c387a88346bdb1324e,서로 자신의 주장을 내세우며 상대편의 주장을 반박함,갑론을박 (甲論乙駁),이럴 땐 사자성어,갑론을박 (甲論乙駁),,,
e6858bca236e4b2191c67a14b8652e1d,전도유망(前途有望)의 뜻은?,앞으로 잘될 희망이 있음,이럴 땐 사자성어,앞으로 잘될 희망이 있음,,,
6cb30dbeafd1445fa37f0140b9b17fe1,대의멸친(大義滅親)의 뜻은?,큰 도리를 지키려고 부모나 형제도 돌아보지 않음 ,이럴 땐 사자성어,큰 도리를 지키려고 부모나 형제도 돌아보지 않음 ,작은 것을 탐하다가 오히려 큰 것을 잃음 ,사람으로서 마땅히 지켜야 할 중대한 의리와 명분 ,
3bddf8d08684470b93677d5b9e951a72,천우신조(天佑神助)의 뜻은?,하늘이 돕고 신령이 도움 ,이럴 땐 사자성어,하늘이 돕고 신령이 도움 ,하늘의 도움을 받지 못함 ,보태고 늘려 도움이 되게 함 ,
7c64c792a625449ca78e54f2b655bc70,입술이 없으면 이가 시리다,순망치한 (脣亡齒寒) ,이럴 땐 사자성어,순망치한 (脣亡齒寒) ,사공중곡 (射空中鵠) ,망중유한 (忙中有閑) ,
378a2ef0d16d41f2aa195b735f297624,진퇴양난(進退兩難)의 뜻은?,이러지도 저러지도 못하는 어려운 처지 ,이럴 땐 사자성어,이러지도 저러지도 못하는 어려운 처지 ,변덕스럽게 이랬다저랬다 함 ,밝혀 말하기 어려운 경우나 처지 ,
816045848a5341f09b3e5471d90a1416,일자무식(一字無識)의 뜻은?,글자를 한 자도 모를 정도로 무식함 ,이럴 땐 사자성어,글자를 한 자도 모를 정도로 무식함 ,글은 모르나 다양한 경험을 가짐 ,알기는 알아도 똑바로 잘 알지 못함 ,
daf84c8777344f4b9394230219a20be9,공평무사(公平無私)의 뜻은?,공평하여 사사로움이 없음 ,이럴 땐 사자성어,공평하여 사사로움이 없음 ,공평하여 치우치지 않음 ,한쪽으로 치우쳐 공평하지 못함 ,
dc1ce3412bcf49139aba37b5b8cb7fcd,일 따위를 처음부터 끝까지 한결같이 함,시종일관 (始終一貫) ,이럴 땐 사자성어,시종일관 (始終一貫) ,사색불변 (辭色不變) ,시근종태 (始勤終怠) ,시종무관 (侍從武官) 
f3e92df92f26414e89f7c8cfc3818d80,허장성세(虛張聲勢)의 뜻은?,실속 없이 큰소리치거나 허세를 부림 ,이럴 땐 사자성어,실속 없이 큰소리치거나 허세를 부림 ,실속 없이 겉만 번드르르하게 꾸밈 ,실속 없는 글을 써서 기를 세우려고 함 ,
ddb24b29b0db48fa821a7cd5e38a0c06,크게 될 사람은 늦게 이루어짐,대기만성 (大器晩成) ,이럴 땐 사자성어,대기만성 (大器晩成) ,기사회생 (起死回生) ,극기복례 (克己復禮) ,대기소용 (大器小用) 
20dc94e3eab4474abff96a330b9a5a0f,성에 차지 않거나 철저하지 못한 안타까움,격화소양 (隔靴搔癢) ,이럴 땐 사자성어,격화소양 (隔靴搔癢) ,시근종태 (始勤終怠) ,사분오열 (四分五裂) ,
6ef5a8878d564a12835ccdfc92dbdf78,몸과 마음을 닦아 수양하고 집안을 다스림,수신제가 (修身齊家),이럴 땐 사자성어,수신제가 (修身齊家),,,
eac251af874843859c4f58dddd6958c4,있는 듯 없는 듯 흐지부지함,유야무야 (有耶無耶),이럴 땐 사자성어,유야무야 (有耶無耶),,,
8680ca7c79754f56adf52c527312fe7c,명약관화(明若觀火)의 뜻은?,불을 보듯 분명하고 뻔함 ,이럴 땐 사자성어,불을 보듯 분명하고 뻔함 ,분명하지 아니하고 어렴풋함 ,쇠붙이를 불에 달구어 시험해 봄 ,
2490bb7528124c1685a550d2e81fe4ea,일사천리(一瀉千里)의 뜻은?,어떤 일이 거침없이 빨리 진행됨 ,이럴 땐 사자성어,어떤 일이 거침없이 빨리 진행됨 ,어떤 일을 빨리 진행하여 빨리 끝냄 ,,
28a9bfcd2add4134b7b4577b805e8dc8,우유부단(優柔不斷)의 뜻은?,어물어물 망설이기만 하고 결단성이 없음 ,이럴 땐 사자성어,어물어물 망설이기만 하고 결단성이 없음 ,멍한 상태로 자꾸 느리게 어물어물 망설임 ,무엇인가 하려다가 문득 망설이며 머뭇거림 ,
06bad644b3284454828c7e3ad184c905,백면서생(白面書生)의 뜻은?,글만 읽고 세상일에는 경험이 없는 사람 ,이럴 땐 사자성어,글만 읽고 세상일에는 경험이 없는 사람 ,실력이 없으면서도 허세로만 떠벌림 ,마음이 맑고 깨끗하며 재물 욕심이 없음 ,
b6a86c62c66245638e1fbbba5fd07a8a,염화미소(拈華微笑)의 뜻은?,말이 아닌 마음에서 마음으로 전하는 일,이럴 땐 사자성어,말이 아닌 마음에서 마음으로 전하는 일,,,
4caf427e0b034bdcb91ce5401190e042,백아절현(伯牙絶絃)의 뜻은?,자기를 알아주는 참다운 벗의 죽음을 슬퍼함 ,이럴 땐 사자성어,자기를 알아주는 참다운 벗의 죽음을 슬퍼함 ,글만 읽고 세상일에는 경험이 없는 사람 ,세상에서는 견줄 사람이 없을 정도로 아름다운 여자 ,
c96762623e644b51b090aa4a30810db9,사물의 이치를 연구하여 지식을 완전하게 함,격물치지 (格物致知) ,이럴 땐 사자성어,격물치지 (格物致知) ,명실상부 (名實相符) ,사근취원 (捨近取遠) ,
c5e635b626e24df6aeaa84db201f1409,길거리에 퍼져 돌아다니는 뜬소문,도청도설 (道聽塗說) ,이럴 땐 사자성어,도청도설 (道聽塗說) ,교언영색 (巧言令色) ,부급종사 (負笈從師) ,
7a90fb70b346446cbf98d93e65ae5543,유쾌하게 이야기함,고담활론 (高談闊論),이럴 땐 사자성어,고담활론 (高談闊論),,,
6f0476da2a97487cb841dc66b799b217,일목요연(一目瞭然)의 뜻은?,한 번 보고도 알 수 있을 만큼 분명함 ,이럴 땐 사자성어,한 번 보고도 알 수 있을 만큼 분명함 ,눈을 비비고 다시 보며 상대를 대함 ,한번 본 것은 잊어버리지 아니함 ,
8caddf311f1d40f5b2bcc78d59d90011,뛰어난 사람은 숨어 있어도 저절로 알려짐,낭중지추 (囊中之錐),이럴 땐 사자성어,낭중지추 (囊中之錐),,,
2ab527bdf80c47be8ec869b205ab0784,호가호위(狐假虎威)의 뜻은?,남의 권세를 빌려 위세를 부림 ,이럴 땐 사자성어,남의 권세를 빌려 위세를 부림 ,계획적으로 간사한 꾀를 냄 ,마음이 음흉하고 욕심이 많은 사람 ,
20d7c76ba1624a0ab1d29eecd34fab5c,'추석'을 일컫는 사자성어는?,중추가절 (仲秋佳節) ,이럴 땐 사자성어,중추가절 (仲秋佳節) ,만추가경 (晩秋佳景) ,추월춘풍 (秋月春風) ,
1d8616f7d35a4fe2b4852d6a520eaf8c,수어지교(水魚之交)의 뜻은?,물과 물고기처럼 떨어질 수 없는 친한 사이,이럴 땐 사자성어,물과 물고기처럼 떨어질 수 없는 친한 사이,,,
e2bc3c24fcb64f4baa73fbd37ad8ea33,촌철살인(寸鐵殺人)의 뜻은?,간단한 말로 남을 감동시키거나 약점을 찌름,이럴 땐 사자성어,간단한 말로 남을 감동시키거나 약점을 찌름,,,
7dc23c1c36964027a58da6612d6e765c,만고불변(萬古不變)의 뜻은?,아주 오랜 세월 동안 변하지 아니함,이럴 땐 사자성어,아주 오랜 세월 동안 변하지 아니함,,,
001f25427ded4bb8a5419c3fa6f84411,절차탁마(切磋琢磨)의 뜻은?,부지런히 학문과 덕행을 닦음 ,이럴 땐 사자성어,부지런히 학문과 덕행을 닦음 ,남의 일을 지나치게 걱정하고 염려함 ,몹시 분하여 이를 갈며 속을 썩임 ,
9d522bfcde5e45a7a73853b4fd559075,마이동풍(馬耳東風)의 뜻은?,남의 말을 귀담아듣지 아니하고 지나쳐 흘려버림 ,이럴 땐 사자성어,남의 말을 귀담아듣지 아니하고 지나쳐 흘려버림 ,말이나 행동을 남의 비위에 맞게 함 ,남의 말에 덩달아 호응하거나 동의하는 짓 ,
9a7f048631c2404c9bf8b001ae60ee28,유언비어(流言蜚語)의 뜻은?,아무 근거 없이 널리 퍼진 소문 ,이럴 땐 사자성어,아무 근거 없이 널리 퍼진 소문 ,잘못 전해서 소란을 일으킨 소문 ,유쾌하고 시원스러운 내용의 소문 ,
4004183ed9814f64bf5387ad1c7d662b,연목구어(緣木求魚)의 뜻은?,불가능한 일을 굳이 하려 함 ,이럴 땐 사자성어,불가능한 일을 굳이 하려 함 ,인연은 간절히 구해야 이루어짐 ,나무와 물고기가 있는 연못 ,
4fb97af4ceb5442fafdf293933f84520,하늘과 땅 사이에 가득 찬 넓고 큰 원기,호연지기 (浩然之氣),이럴 땐 사자성어,호연지기 (浩然之氣),,,
cb7a961a14734663bfff537e36b3402d,동고동락(同苦同樂)의 뜻은?,괴로움도 즐거움도 함께함 ,이럴 땐 사자성어,괴로움도 즐거움도 함께함 ,같은 자리에 자면서 다른 꿈을 꿈 ,마음이 음흉하여 겉과 속이 다름 ,
